[
  {
    "number": 1,
    "title": "Why AI Matters Now",
    "concepts": ["context", "intent-interface", "retrieval"],
    "primitives": ["interface", "context", "view-projection"],
    "coreIdea": "AI is becoming a new interface between people, knowledge and software.",
    "keyLines": [
      "AI is changing how we interact with information and software.",
      "In the past, we had to learn how software works.",
      "Now software is starting to understand how we communicate.",
      "Natural language is becoming a new user interface.",
      "That makes digital capabilities accessible to many more people."
    ],
    "realCase": [
      "Think about finding information inside a company. Today, an employee may search SharePoint, open several documents, check emails and ask colleagues.",
      "With AI, the interaction can become much simpler. The employee can describe the question in natural language, and AI can help find, summarize and connect the relevant information.",
      "The important change is not just faster search. The user no longer needs to understand where every piece of information is stored."
    ],
    "discussionQuestion": "Where in your daily work do you spend too much time finding information?",
    "endingLabel": "Transition",
    "ending": "Once AI understands what we want, the next question is how much work we want it to do for us."
  },
  {
    "number": 2,
    "title": "Copilot vs Agent",
    "concepts": ["agent-loop", "delegation", "goal"],
    "primitives": ["actor", "goal", "capability-tool", "execution"],
    "coreIdea": "A copilot helps you do the work. An agent can take responsibility for part of the work.",
    "keyLines": [
      "A copilot usually works together with a human.",
      "You ask, it responds, and you stay in control of every step.",
      "An agent can work toward a goal across multiple steps.",
      "It can use tools, make decisions and take actions.",
      "The important difference is the level of delegation."
    ],
    "realCase": [
      "Imagine preparing a weekly project report.",
      "A copilot can summarize documents when you ask.",
      "An agent could collect the latest project information, identify important changes, prepare the report, and send it to you for review.",
      "The key shift is from asking AI individual questions to giving AI a goal."
    ],
    "discussionQuestion": "What part of your work would you feel comfortable delegating to an agent?",
    "endingLabel": "Transition",
    "ending": "If an agent can take responsibility for work, we need to understand what actually makes an agent possible."
  },
  {
    "number": 3,
    "title": "What Makes an Agent?",
    "concepts": ["approval", "context", "guardrail", "long-term-memory", "tool"],
    "primitives": ["model", "context", "capability-tool", "memory", "permission", "constraint"],
    "coreIdea": "An agent combines intelligence with context, tools, memory and boundaries.",
    "keyLines": [
      "The model gives the agent intelligence.",
      "Context tells the agent what is happening.",
      "Tools allow the agent to interact with the outside world.",
      "Memory helps it keep useful information over time.",
      "Guardrails define what the agent is allowed to do."
    ],
    "realCase": [
      "Imagine an agent helping with customer requests.",
      "The language model can understand the request.",
      "Context gives it customer and product information.",
      "Tools allow it to search a database or create a ticket.",
      "Memory can preserve previous interactions.",
      "Guardrails can require human approval before certain actions.",
      "Together, these pieces turn a language model into a working system."
    ],
    "discussionQuestion": "Which of these five elements do you think is hardest to build well in an enterprise?",
    "endingLabel": "Transition",
    "ending": "But having all these capabilities still does not guarantee reliable behavior. That is where the harness becomes important."
  },
  {
    "number": 4,
    "title": "Agent Harness",
    "concepts": ["approval", "artifact", "evidence", "failure-containment", "harness", "permission", "termination"],
    "primitives": ["harness", "context", "capability-tool", "permission", "recovery", "evidence", "observation-trace"],
    "coreIdea": "The harness defines how an agent operates safely and reliably around the model.",
    "keyLines": [
      "A powerful model does not automatically create a reliable agent.",
      "The harness controls how the agent gets context and uses tools.",
      "It defines permissions, approvals, error handling and evidence.",
      "It also helps the agent understand when the task is complete.",
      "The model provides intelligence. The harness provides discipline."
    ],
    "realCase": [
      "Imagine an agent updating an engineering document.",
      "Writing new text is relatively easy.",
      "The harder questions are different.",
      "Which documents can it access?",
      "Can it overwrite the original file?",
      "Should it create a new version?",
      "When does it need approval?",
      "What happens when a tool fails?",
      "How do we know what it changed?",
      "These are harness questions."
    ],
    "discussionQuestion": "If an AI agent could access your work systems tomorrow, what controls would you want around it?",
    "endingLabel": "Transition",
    "ending": "Some tasks need this kind of reasoning and control. Other tasks are much more predictable."
  },
  {
    "number": 5,
    "title": "Workflow vs Agent",
    "concepts": ["agent-loop", "context", "deterministic-shell", "workflow"],
    "primitives": ["flow", "reasoning", "execution", "rule-policy"],
    "coreIdea": "Use workflows for predictable paths and agents when the path depends on context.",
    "keyLines": [
      "Workflows are strong when rules are clear.",
      "Agents become useful when the next step depends on judgment.",
      "Predictability is valuable.",
      "Flexibility is also valuable.",
      "The right architecture often combines both."
    ],
    "realCase": [
      "Consider an invoice approval process.",
      "If every invoice follows the same approval rules, a workflow is usually enough.",
      "Now imagine a supplier sends an unusual request with incomplete documents and several possible exceptions.",
      "An agent can understand the situation and decide what information is missing.",
      "A workflow can then execute the approved process reliably."
    ],
    "discussionQuestion": "Which processes in your team are predictable, and which ones require real judgment?",
    "endingLabel": "Transition",
    "ending": "Whether we use a workflow or an agent, both depend heavily on the information we give them."
  },
  {
    "number": 6,
    "title": "From Prompting to Context Engineering",
    "concepts": ["context-engineering", "context-selection", "prompt", "retrieval"],
    "primitives": ["context", "memory"],
    "coreIdea": "Good AI results increasingly depend on good context.",
    "keyLines": [
      "Prompting is useful, but it is only one part of the system.",
      "AI needs the right information at the right time.",
      "Good context can include documents, data, instructions and previous actions.",
      "Poor context creates poor decisions.",
      "Context engineering is becoming a core AI capability."
    ],
    "realCase": [
      "Suppose you ask AI to write a project status report.",
      "A clever prompt may improve the writing.",
      "But if the AI does not know the current schedule, open issues, decisions and latest changes, the report will still be weak.",
      "The quality of the answer depends heavily on the quality of the context."
    ],
    "discussionQuestion": "What information would AI need before it could really understand your work?",
    "endingLabel": "Transition",
    "ending": "Inside a company, some of the most valuable context comes from organizational knowledge."
  },
  {
    "number": 7,
    "title": "Enterprise Knowledge",
    "concepts": ["context-engineering", "grounding", "provenance-chain", "rag", "retrieval"],
    "primitives": ["context", "evidence", "memory"],
    "coreIdea": "Enterprise AI becomes valuable when it can work with the knowledge people actually use.",
    "keyLines": [
      "Companies already have huge amounts of knowledge.",
      "The problem is that this knowledge is often fragmented.",
      "It lives in documents, emails, databases and people’s experience.",
      "AI can help connect these sources.",
      "But the knowledge must still be accurate, accessible and governed."
    ],
    "realCase": [
      "Imagine a new engineer joining a project.",
      "Important information may be spread across SharePoint, old reports, meeting notes, emails and senior engineers’ experience.",
      "An AI assistant can help connect these sources and answer questions with relevant references.",
      "This can reduce the time required to understand a project."
    ],
    "discussionQuestion": "Where does the most valuable knowledge in your team currently live?",
    "endingLabel": "Transition",
    "ending": "Knowledge helps AI understand the situation. Tools allow AI to do something about it."
  },
  {
    "number": 8,
    "title": "Tools and Actions",
    "concepts": ["permission", "tool", "tool-calling"],
    "primitives": ["capability-tool", "permission", "execution"],
    "coreIdea": "AI creates more value when it can move from answering questions to taking useful actions.",
    "keyLines": [
      "A language model can generate information.",
      "Tools allow it to interact with real systems.",
      "It can search, create, update or trigger processes.",
      "Every new tool increases capability.",
      "Every new tool also increases responsibility and risk."
    ],
    "realCase": [
      "An employee asks an AI assistant about annual leave.",